{
  "automatic_promotion": false,
  "available_at": "2026-10-17T10:00:00Z",
  "challenger_policy_hash": "bbbbbbbbbbbbbbbbbbbbbbbbbbbbbbbbbbbbbbbbbbbbbbbbbbbbbbbbbbbbbbbb",
  "changes_trade_path": true,
  "cohort_manifest_hash": "aaaaaaaaaaaaaaaaaaaaaaaaaaaaaaaaaaaaaaaaaaaaaaaaaaaaaaaaaaaaaaaa",
  "control_policy_hash": "aaaaaaaaaaaaaaaaaaaaaaaaaaaaaaaaaaaaaaaaaaaaaaaaaaaaaaaaaaaaaaaa",
  "counterfactual_basis": "WHOLE_POLICY",
  "decision_at": "2026-10-17T10:01:00Z",
  "decision_cutoff": "2026-10-17T10:01:00Z",
  "discovered_count": 100,
  "experiment_id": "fixture:experiment:1",
  "expires_at": "2026-10-17T10:05:00Z",
  "fill_model_hash": "aaaaaaaaaaaaaaaaaaaaaaaaaaaaaaaaaaaaaaaaaaaaaaaaaaaaaaaaaaaaaaaa",
  "hypothesis_id": "fixture:hypothesis:1",
  "implementation_evidence_level": "SPEC_ONLY",
  "included_count": 100,
  "independent_cash_replay": true,
  "missing_count": 5,
  "outcome_available_at": "2026-10-18T10:00:00Z",
  "reality": "SYNTHETIC",
  "record_id": "fixture:MatchedOpportunityExperiment:1",
  "rejected_count": 60,
  "resampling_unit": "EVENT_TIME_ASSET_CLUSTER",
  "research_source_class": "SYNTHETIC",
  "result_label": "SIMULATED_COUNTERFACTUAL",
  "schema_version": "1.0",
  "sealed_at": "2026-10-17T09:59:00Z",
  "source_refs": [
    "fixture:controlled-input-only"
  ],
  "trade_authorized": false,
  "validation_policy_id": "fixture:validation:1"
}
